"","ID","Name","Glottocode","Glottolog_Name","ISO639P3code","Macroarea","Latitude","Longitude","Family","SourceFile","Contributor","Base.Chan","Base.Mamta","Comment.Chan","Comment.Mamta"
"344","sadu1234-1","Sadu, China","sadu1234","Sadu",NA,"Eurasia",24.3,102,"Sino-Tibetan","Sadu.htm","Prof. Xianming Xu, Research Centre for Endangered Languages, Yuxi Normal University, Yuxi City, Yunnan, China, December 18, 2010.",NA,"","Sadu is a newly discovered language with a numeral system similar to that of Lisu language. There is almost no literature on the Sadu ethnic group. The historical background we acquired was mainly from oral narration delivered by the elders in the three hamlets. According to limited local Chinese records and some olders’ oral narrations, it was said that Li clan in Jiaoyuan and Bi clan in Dashuitang hamlet moved from Hetaoyuan Township in Kunyan County and Baofeng Township of Jinning County in the Qing Dynasty. Originally they belonged to a sub-branch of Yi who claimed to be “Samodu”, whose ancestors were referred to “Ximodi” in Tang Dynasty, and as “Ximotu” in Yuan Dynasty. This group of people was named as “Bailuoluo Samodu” after Ming Dynasty. Nowadays, the villagers of the Li clan acknowledge that they are the descendants of Dali Bai nationality, however. They call themselves Sadu. Yet they use different names to distinguish themselves from one hamlet to another. The people from Xincun village call themselves Suonapo. The people from Tashuitang call themselves Tatapo; The people from Jiaoyuan claimed themselves Lilepo. They all were referred as Bai-Yi before 1958. They were designated by the Government as Bai nationality in 1858. Nevertheless, the language is very unique. It is neither intelligible to Yinyuan Bai, nor Dali Bai, nor local Yi. Sadly, we found that the descendants of preceding generations in Hetaoyuan and Baofeng Townships now all have shifted Chinese. Therefore, this group of people was redefined as the Sadu. According the identification, the Sadu language belongs to one of the languages of the Tibeto-Burman branch of the Sino-Tibetan language family. However, the Sadu language is a lesser-known language. It is not intelligible to Bai, nor the neighboring Yi. It is necessary to redefine the genetic affiliation explicitly based on core words, phonology, words formation and grammar analysis as well as comparison with related language Yuxi Municipality is located in the middle of Yunnan Province, with a distance of 88 kilometers from Kunming city, the provincial capital. Yuxi Municipality, with a total area of 15,285 km², consists of one district and eight counties under its jurisdiction, namely, Hongta District, Tonghai County, Jiangchuan County, Chengjiang County, Huaning County, Yimen County, Eshan Yi Autonomous County, Xinping Yi and Dai Autonomous County and Yuanjiang Hani, Yi and Dai Autonomous County. There are 25 nationalities with a total population of 2.276 million in Yuxi Municipality. They are Chinese, Yi, Hani, Dai, Hui, Bai, Mongolia, Miao, Lahu nationality groups, etc. Over 33 percent of the total population in the Yuxi Municipality territory is the minority nationalities. Hongta District, where is the political, economic and cultural center has a population of 400,000 in 2009 census. There are 3 sub-districts, 6 towns, and 2 townships of Nationalities under the jurisdiction of Hongta District. They are Yuxinglu Sub-district, Fenghuanlu Sub-district and Yudailu Sub-district; Beicheng Township, Chunhe Township, Liqi Township, Dayingjie Township, Yanhe Township, Gaocan Township, Xiaoshiqiao Yi Nationality Township and Luohe Yi Nationality Township. The Sadu inhibit in Jianyuan village at Beicheng Township, Xincun and Dashuitang villages in Chunhe Township. The three hamlets are located in east longitude 102°17′32″ and north latitude 24°08′30″, in the mountains between 1700 and 1900 meters height above sea-level. The distances among three hamlets are ranged from 6 to 10 km. They are surrounded by Yi, Han, Hani and Hui as well as other minority nationalities. It is located in a high mountain, 6 km away from the Cluster seat, and 20 km away from Beicheng Township government headquarter, and 40 km away from Yuxi city seat. Xincun and Dashuitang are two of four hamlets at Boyi Village Cluster. They are 4 and 6 km away from the Cluster seat, and 12 and 18 km away from Chunhe Township government headquarter, and 20 and 26 km away from Yuxi city seat, respectively. The total population in Chunhe Township Administrative jurisdiction is 55,368. Of them 5,310 are Yi; 996 are the Sadu, officially Bai. The population in three hamlets are 1756, the Sadu are 1505, which comprises 85.7 percent. The Yi are 175 and Han are 21, which comprise 9.97 and 1.2 percent, respectively. Other minority nationalities are only 5, which comprise 0.3 percent, who came to the village by marriage.",""
"345","saja1240-1","Miji (Dammai, Sajalong), India","saja1240","Sajolang","sjl","Eurasia",27.57952,92.77,"Sino-Tibetan","Miji.htm","Mr. Christopher Weedall, PhD student, The Australian National University, Canberra, Australia. July 18, 2013. Date collected on February 28, 2013 - March 9, 2013, February 16, 2014.",NA,"","Miji or Sajolang, preferred recently by speakers, is spoken has in Dhammai or Miji / Nafra villages, West Kameng District, Arunachal Pradesh, Northeast India. For number 'four', /blaj'/ is pronounced in some villages; For number 'hundred' bl̥ǒŋʔ.ˌ(ə)ŋ, this is made of b.l̥oŋʔ (hundred) and uŋ (one). As for the other numbers, they are very easy. Up to 100, it's the number of 10's (e.g. 30 = 3 10), followed by digits (e.g. 34 = 3 10 4) There's nothing special or unexpected. Above 100, it's 100 + number of hundreds followed by the same system from 1 to 99 (e.g. 234 = 100 2 3 10 4). So the number of 100's flips behind the hundred, in contrast to the system of 10's. They have no words for 1,000 and simply use Hindi for numbers 1,000 and above. Note that Sajolang is a tonal language.",""
"346","saja1240-2","Miji (Dammai, Sajalong), India","saja1240","Sajolang","sjl","Eurasia",27.57952,92.77,"Sino-Tibetan","Miji.htm","Prof. Awadesh Mishra. Dept of Linguistics/ESL/ELE, English & Foreign Languages University, Shillong, Meghalaya, India. November 12, 2010.","decimal","","Miji has a decimal numeral system different from other members of Tibeto-Burman languages in Northeast India.",""
"347","saja1240-3","Miji (Dammai, Sajalong), India","saja1240","Sajolang","sjl","Eurasia",27.57952,92.77,"Sino-Tibetan","Miji.htm","Prof. Suhnu Ram Sharma, Deccan College Post-Graduate and Research Institute, Pune, India, January 7, 1993. Reference sourceː Simon, I. M. , 1990. Miji Language Guide. Directorate of Research, Government of Arunachal Pradesh, Shillong, India",NA,"","Miji is an unclassified language spoken in Arunachal Pradesh, West Kemang District by 6000 speakers. The numbers with an asterisk were provided by Mr. Daniel Wood, department of Linguistics, University of Oregon, Eugene, USA. May 30, 2009.",""
"348","saka1283-1","Sakachep (Khelma), India","saka1283","Sakachep-Chorei","sch","Eurasia",25.994,93.949,"Sino-Tibetan","Sakachep.htm","Ms. Monali Longmailai, Graduate Student, Department of Linguistics, North-Eastern Hill University, Shillong, Meghalaya, India. May 7, 2013.","decimal","","The Sakachep language is spoken in north-east India mainly in Assam, Manipur and Nagaland (also known as Khelma in Assam and Nagaland), belongs to the central Kuki-Chin group of the Tibeto-Burman language family. It numerals follow decimal counting system. In 10s and 20s in the numeral data chart given here, the numerals undergoing morpho-phonological processes are affixed with the units for 10s sɔmleɪ and 20s sɔmnɪk, while those that do not undergo any morpho-phonological processes remain as separate words. 17th Ethnologue classified as an unclassified language.",""
"349","sama1295-1","Samatao (Samudu), China","sama1295","Samatao","ysd","Eurasia",25.012,102.2,"Sino-Tibetan","Samatao-Samu.htm","Dr. Yude Yu Defen, Yunnan Nationalities University, Yunnan, China, May 25, 2014","decimal","","Samatao or Samadu or Samaduo has a decimal system. Samu is a highly endangered Nisoid language spoken by older adults in Zijun Village 子君村(also called Da'er), Yiliu Township 矣六乡, Guandu District 官渡区, Kunming, China. Although there is an ethnic population of 2,465 as of 1999, there are no fluent speakers under 50 years of age.",""
"350","sama1295-2","Samatao (Samu), China","sama1295","Samatao","ysd","Eurasia",25.012,102.2,"Sino-Tibetan","Samatao-Samu.htm","Dr. Lama Ziwo (aka Qiu Fuyuan) College of Yi Studies, Southwest University for Nationalities (Old Campus), Chengdu, Sichuan, China. November 19, 2012.","decimal","","Samatao or Samu has a decimal system. Samu is a highly endangered Nisoid language spoken by older adults in Zijun Village 子君村(also called Da'er), Yiliu Township 矣六乡, Guandu District 官渡区, Kunming, China. Although there is an ethnic population of 2,465 as of 1999, there are no fluent speakers under 50 years of age.",""
"351","samp1249-1","Sampang, Nepal","samp1249","Sampang","rav","Eurasia",27.2999,87.0019,"Sino-Tibetan","Sampang.htm","Ms. Mari-Sisko Khadgi and Mr. David Rutherford . Informantː Dhan Kumar Rai, Nepal. March 15, 2007.","decimal","","Sampang has a decimal system. Sampang numeral 80 is different from other decades. Some compound numerals 21 to 25, 28 and 29 are missing.",""
"352","sang1320-1","Sangkong, China","sang1320","Sangkong","sgk","Eurasia",21.64,100.77,"Sino-Tibetan","Sangkong.htm","Prof. Li Yongsui, Centre of Minority Languages, Chinese Academy of Sciences, Beijing, China, October 3, 2006.",NA,"","Sang Kong is an endangered language discovered in 1988, with about 1,000 speakers in four villages in Jing Hong Xishuangbanna Dai, Yunnan Province. Note that in compound numerals, the numeral 'one' in 11 and 21 are different.",""
"353","sang1321-1","Sangtam Naga, India","sang1321","Sangtam Naga","nsa","Eurasia",25.8581,94.6279,"Sino-Tibetan","Sangtam-Naga.htm","Miss Imlienla Imchen, researcher scholar, department of Linguistics, North-Eastern Hill University, Shilong, India. May 24, 2013.","decimal","","Sangtam Naga has a decimal system. The above data which I collected are from the Sangtam Naga spoken in Longkhim-Chare area (Tuensang). The word' bə' in compound numerals 21 to 29 means 'and', and the hatʃar is a borrowed word from Hindi 'hatʃar'.",""
"354","sang1321-2","Sangtam (Lophomi), India","sang1321","Sangtam Naga","nsa","Eurasia",25.8581,94.6279,"Sino-Tibetan","Sangtam-Naga.htm","Dr. Shree Krishan, Anthropological Survey of India, Government of India, Calcutta, India, March 10, 1995.","decimal","","Sangtam Naga has a decimal system. The above data were in orthographic spellings and incomplete. Phonetic transcriptionsː ü = ɨ, ng = ŋ, th = tʰ, kh = kʰ",""
"355","sani1269-1","Sani Yi, China","sani1269","Sani","ysn","Eurasia",24.278,103.759,"Sino-Tibetan","Yi-Sani.htm","Prof. Sun Hongkai, Centre of Minority Languages, Chinese Academy of Sciences, Beijing, China, October 3, 1999.","decimal","","Sani Yi has a decimal system.",""
"356","sart1249-1","Sartang, India","sart1249","Sartang","onp","Eurasia",27.375914,92.409383,"Sino-Tibetan","Sartang.htm","Mr. Tim Bodt, PhD Student, Himalayan Languages Projects, Bern University, Switzerland, August 27, 2013.","vigesimal","","The above data is taken from Khətamji Nyuk [kʰətamd͡ʒi ɲuɁ] and Rəphinji Nyuk [rəpʰind͡ʒi ɲuɁ]–two western Sartang dialects of Salari, Khoitam, Rahung and nearby villages, Dirang circle, West Kameng district, Arunachal Pradesh, India. This language has a basic vigesimal system common to Bodish languages. 1-20 only; multiples of one score (twenty). Glottal reinforcement and replacement of syllable-final plosives; nasalized vowels appear to be the result of loss relatively recent loss of syllable-final nasal stops and nasalized vowels might not be distinctive. Numerals above 100 use Bodish loans, including one thousand. Unlike the Sherdukpen dialects, the Sartang dialects use the ablative case marker /-lo/ even in numerals 11-19.",""
"357","sart1249-2","Sartang, India","sart1249","Sartang","onp","Eurasia",27.375914,92.409383,"Sino-Tibetan","Sartang.htm","Mr. Tim Bodt, PhD Students, Himalayan Languages Projects, Bern University, Switzerland, August 27, 2013.",NA,"","The above data is taken from Kəshingji Nyuk [kəʃĩŋd͡ʒi ɲuɁ] (a.k.a. Butpa, Boot Monpa) and Khɯnuji Nyuk [kʰɯnud͡ʒi ɲuɁ] – two eastern Sartang dialects of Jerigaon and Khoina villages, Nafra circle, West Kameng district, Arunachal Pradesh, India.",""
"358","seke1240-1","Seke (Tangbe dialect), Nepal","seke1240","Seke (Nepal)","skj","Eurasia",28.9251,83.8064,"Sino-Tibetan","Seke.htm","Dr. Isao Honda, University of Nagoya, Osaka, Japan, May 10, 2009.","decimal","","Seke has a decimal system similar to that of Thakali. The above data was taken from Tangbe dialect. There are there are 4 tones in Seke (Tangbe), two high (tone 1 and 2) and two low (tone 3 and 4). H stands for a high tone (either tone 1 or tone 2) and L stands for a low tone (either tone 3 or tone 4).",""
"359","sent1260-1","Senthang Chin, Myanmar","sent1260","Senthang Chin","sez","Eurasia",21.8936,93.8087,"Sino-Tibetan","Chin-Senthang.htm","Ms. Mai Ngun Tin Par, Payap University, Chiangmai, Thailand. April 22, 2013.",NA,"","Senthang Chin has a numeral system. Senthang is a tonal language and basically Senthang has three tonesː high ˥, mid ˧, and low ˩ .",""
"360","sgaw1245-1","Sgaw Karen, Myanmar","sgaw1245","S'gaw Karen","ksw","Eurasia",17.9872,97.7126,"Sino-Tibetan","Karen-Sgaw.htm","Miss. Hsar Shee, MA student, Department of linguistics, Payap University, Chiangmai, Thailand. October 6, 2010.","decimal","","Sgaw Karen has a decimal system.",""
"361","sgaw1245-2","Sgaw Karen, Myanmar","sgaw1245","S'gaw Karen","ksw","Eurasia",17.9872,97.7126,"Sino-Tibetan","Karen-Sgaw.htm","Mr. Mark Wannemacher, Summer Institute of Linguistics, Thailand, November 30, 1994.","decimal","","Sgaw Karen has a decimal system.",""
"362","shan1292-1","Shanghang Hakka, China","shan1292","Shanghang",NA,"Eurasia",NA,NA,"Sino-Tibetan","Chinese-Hakka-Shanghang.htm","Dr. Qiu Xifeng, Fujian Teacher's University, Fuzhou, Fujian, China, March 29, 2006.",NA,"","Shanghang Hakka is spoken in Shanghang county in western Fujian Province.",""
"363","shec1234-1","Tangshang Naga (Shecyü), Myanmar","shec1234","Shecyu-Chamchang",NA,"Eurasia",NA,NA,"Sino-Tibetan","Naga-Tangshang.htm","Mr. Khämlan Binkhäm, MA student, Department of linguistics, Payap University, Chiangmai, Thailand. July 9 2018","decimal","","Tangshang Naga has a decimal system. The above data are from the Shecyü variety of Tangshang Naga of Naga Hills, Myanmar. Tangshang Naga belongs to the Tangsa Subgroup spoken in Naga Hills of Myanmar and of Chamchang in India, which are dialect of the same language. Shecyü is an undescribed Tase Naga varieties belonging to the Northern Naga branch of Tibeto-Burman spoken in Myanmar by around 1,000 speakers. Tangshang is a new ethnonym for various glossonyms, including Tangsa or Tase and any of their 22 subgroupings (Jay & Khan, 2010). Another Tangshang variety almost identical with Shecyü is Chamchang is India with 1,200 estimated speakers in Arunachal State.",""
"364","sher1255-1","Sherpa, Nepal, China","sher1255","Solu-Khumbu Sherpa","xsr","Eurasia",27.674,86.9994,"Sino-Tibetan","Sherpa.htm","Mr. Sang-Yong Lee, Summer Institute of Linguistics, Nepal, February 20, 2007.","vigesimal","","Sherpa has a vigesimal system.",""
"365","sher1257-1","Sherdukpen (Sẽnji Nyuk), India","sher1257","Sherdukpen","sdp","Eurasia",27.0035,92.5799,"Sino-Tibetan","Sherdukpen.htm","Mr. Tim Bodt, PhD Student, Himalayan Languages Projects, Bern University, Switzerland, August 27, 2013.","vigesimal","","The above data is taken from Sẽnji Nyuk [sẽnd͡ʒi ɲuɁ], Shergaon village, Khalaktang circle, West Kameng district, Arunachal Pradesh, India. This language has a basic vigesimal system; 1-20; multiples of one score (twenty). Unlike the Sartang dialects, the Sherdukpen dialects use the ablative case marker /-lo/ only in numerals 21 and higher, with simplification in numbers 11-19 through loss of this suffix (infix). Syllable-final alternation between velar plosive /k/ and (alveolo-)dental plosive /t/ common; nasal vowels appear to be the result of loss relatively recent loss of syllable-final nasal stops, alternation between nasalized vowel and nasal stop and nasal vowel can still be observed, speakers do not commonly perceive a distinction between the two, and nasalized vowels might not be distinctive. Whereas the older generation still uses the palatalized velar initial /gj/, in the younger generation this is affricated to /j/ [d͡ʒ]. Native khakhu ‘five score = 100’ has been completely replaced by gjo ‘one hundred’ which is in turn rapidly replaced by Bodish loan ja or Hindi सौ [sau]. Numerals above 100 use Hindi or Bodish loans, including one thousand hazaar/tongtra.",""
"366","sher1257-2","Sherdukpen (Thõngji Nyuk), India","sher1257","Sherdukpen","sdp","Eurasia",27.0035,92.5799,"Sino-Tibetan","Sherdukpen.htm","Mr. Tim Bodt, PhD Students, Himalayan Languages Projects, Bern University, Switzerland, August 27, 2013.","vigesimal","","The above data is taken from Thõngji Nyuk [tʰõŋd͡ʒi ɲuɁ] (Sherdukpen), Rupa village, Rupa circle, West Kameng district, Arunachal Pradesh, India. Decimalisation of the vigesimal counting system can be observed in Rupa Sherdukpen, but is a recent artificial construction.",""
"367","sher1257-3","Sherdukpen, India","sher1257","Sherdukpen","sdp","Eurasia",27.0035,92.5799,"Sino-Tibetan","Sherdukpen.htm","Rinchin Dondrup, 1988. A Hand book Sherdukpen Language. Directorate of Research, Government of Arunachal Pradesh, Itanagar, India","vigesimal","","The Sherdukpen has a vigesimal system. The above Sherdukpen numeral system is in orthographic spellings, more reliable data in phonetic form and indicated tones are needed to compare with the old data.",""
"368","shes1236-1","Sheshi Kham, Nepal","shes1236","Sheshi Kham","kip","Eurasia",27.9437,82.6467,"Sino-Tibetan","Kham-Sheshi.htm","Dr. David E. Watters, Summer Institute of Linguistics, Nepal, January 4, 1996.",NA,"","Sheshi Kham has only numerals 'one' to 'two' of Tibeto-Burman origin, higher numerals are borrowed from Nepali.",""
"369","shex1234-1","Shexian Hui, China","shex1234","Shexian",NA,"Eurasia",30.589829,118.428268,"Sino-Tibetan","Chinese-Hui-Shexian.htm","Mr. Jin Jiaqi, Huangshan Teacher Training School, Huangshan City, Anhui, China, March 24 2006",NA,"","In Shexian Hui, the numeral 'two' has two forms, used in different positions. The Shexian Hui is spoken by about 150,000 people in Shexian County, South Anhui Province and is different from other Hui varieties.",""
"370","shix1238-1","Shixing, China","shix1238","Shixing","sxg","Eurasia",28.3895,100.4,"Sino-Tibetan","Shixing.htm","Prof. Sun Hongkai, Centre of Minority Languages, Chinese Academy of Sciences, Beijing, China, October 3, 1999.","decimal","","Shixing has a decimal system.",""
"371","shum1243-1","Shumcho, India","shum1243","Shumcho","scu","Eurasia",31.6862,78.3865,"Sino-Tibetan","Shumcho.htm","Dr. Christian Huber, Department of linguistics, University of Vienna, Austria, data taken from Kanam village, Himachal Pradesh, Distt. Kinnaur, June 4, 2011.","vigesimal","","Chumcho has a vigesimal system. There are alternative terms for 30 and 50ː 30ː sɯmtɕu ""30 (3×10)"" is a loan from Tibetan or nɪsau sa (20+10); ɖai ""2,5"" (in ɖai nɪsa ""50"") and hɐzar ""1000"" are loans from Indo-Aryan.",""
"372","shun1239-1","Shunchang Min, China","shun1239","Shunchang",NA,"Eurasia",NA,NA,"Sino-Tibetan","Chinese-Min-Shunchang.htm","Assist. Prof. Feng Aizhen, Institute of Linguistics, Chinese Academy of Sciences, Beijing, China, March 13, 2006",NA,"","Shunchang is spoken by about 150,000 people in Shunchang County, central Fujian Province. In Shunchang Min, the number 'one' has two forms used in different positions. This language is not mutually intelligible with Minnan or other Min languages.",""
"373","sich1238-1","Sichuan Yi, China","sich1238","Sichuan Yi","iii","Eurasia",28.1947,102.121,"Sino-Tibetan","Yi-Sichuan.htm","Prof. Sun Hongkai, 3 October, 1999 Centre of Minority Languages, Chinese Academy of Sciences, Beijing, China",NA,"",NA,""
"374","sikk1242-1","Sikkimese, Sikkim, India","sikk1242","Sikkimese","sip","Eurasia",27.85795,88.59153,"Sino-Tibetan","Sikkimese-Bhutia.htm","Prof. Udaya Singh and Linguistic and Cultural Documentation team, Central Institute of Indian Languages, Mysore, India, December 22, 2008.","decimal","","Danjongka has a decimal system.",""
"375","sila1247-1","Sila (Naahok Village), Vietnam, Laos","sila1247","Sila","slt","Eurasia",21.6888,102.134,"Sino-Tibetan","Sila.htm","Prof. Takashi Kato, Center for Asian and Pacific Studies, Seikei University, Musashino, Tokyo, Japan. February 2, 2010, January 19, 2011.","decimal","","The above data was taken from Naahok Village, Nyot U District, Phongsali Province, Laos. Note that some numerals of this variety are different from that of the variety in Vietnam side.",""
"376","sila1247-2","Sila (Ban Ban Sida), Vietnam, Laos","sila1247","Sila","slt","Eurasia",21.6888,102.134,"Sino-Tibetan","Sila.htm","Dr. Nathan Badenoch, Socio-Economic Research Adviser, Northern Agriculture and Forestry Research, Center Luang Prabang, Lao PDR. February 2, 2010.","decimal","","The above data was taken from vɛ³³ ɲɯ³³ Ban Ban Sida, Muang Nam Tha, Luang Nam Tha, Laos. Note that some numerals of this variety are different from that of the variety in Vietnam side.",""
"377","sila1247-3","Sila, Vietnam, Laos","sila1247","Sila","slt","Eurasia",21.6888,102.134,"Sino-Tibetan","Sila.htm","Dr. Jerold A. Edmondson, University of Texas at Arlington, USA, October 20, 1998.","decimal","","Sila has a decimal system.",""
"378","simt1238-1","Simte, India","simt1238","Simte","smt","Eurasia",24.5444,93.3265,"Sino-Tibetan","Simte.htm","S. Liangao Soto and Benjamin Rai, Translation Centre, The Bible Society of India, Shillong, India, August 11, 1995.",NA,"","Simte numeral system is identical to that of Thadou. Simte data was written in orthographic spellings.",""
"379","sing1264-1","Singpho, India, Myanmar","sing1264","Northern Jinghpaw","sgp","Eurasia",27.296,95.606,"Sino-Tibetan","Singpho.htm","Prof. Suhnu Ram Sharma, Deccan College Post-Graduate and Research Institute, Pune, India, January 7, 1993.",NA,"","The Singpho numerals are nearly identical to that of the Jingpho in China, the original data did not indicate tone marks.",""
"380","situ1238-1","Situ Jiarong, China","situ1238","Situ",NA,"Eurasia",31.590536,102.660664,"Sino-Tibetan","Jiarong-Situ.htm","Dr. Guillaume Jacques, Centre de Recherches Linguistiques sur l’Asie Orientale (CRLAO) / Université Paris V, Paris Descartes, France. September 13, 2008.","decimal","","Situ Jiarong has a decimal system. Situ Jiarong is a tonal language.",""
"381","sona1244-1","Sonaga, China","sona1244","Sonaga","ysg","Eurasia",26.55,103.33,"Sino-Tibetan","Yi-Sonaga.htm","Mr. Andy Castro, SIL International, East Asia, April 20, 2009.","decimal","","Sonaga has a decimal system. Sonaga is a newly discovered language.",""
"382","sorb1250-1","Sorbung, India","sorb1250","Sorbung",NA,"Eurasia",24.7473696,94.315422,"Sino-Tibetan","Sorbung.htm","Dr. David Mortensen, Dept. of Linguistics, University of Pittsburgh, Pittsburgh, PA 15260, USA, February 27, 2010.",NA,"","Sorbung is a Tibeto-Burman language spoken by some members of the Tangkhul ethnicity in the southern part of Ukhrul District, Manipur Province, India. There is currently no published documentation on the language and it has no Ethnologue designation. The exact genetic affiliation with Tibeto-Burman is uncertain. There are about 600 people living in Sorbung village. However, my consultants tell me that a very similar language variety is spoken in several of the surrounding villages and that the area shows less linguistic diversity than most of the Tangkhul area. Sorbung has some very Kuki-Chin like characteristics, extending beyond the numeral system. While its speakers consider themselves to be ethnically Tangkhul, I think that--linguistically-- they are probably closer to Kuki-Chin (but perhaps not within the established Kuki-Chin subgroup).",""
"383","sout2715-1","Southern Ghale, Nepal","sout2715","Southern Ghale","ghe","Eurasia",28.106,84.8511,"Sino-Tibetan","Ghale-South.htm","Ms. Mari-Sisko Khadgi and Mr. David Rutherford, Informants: Rajman Ghale & Prija Jirel Ghale. Nepal, March 15 2007.",NA,"","Nowadays, Southern Ghale traditional numerals after ten might be replaced by Nepali numerals with pronunciation modifications. More completed data needed.",""
"384","sout2722-1","Southern Muji, China","sout2722","Southern Muji","ymc","Eurasia",22.87312,103.306087,"Sino-Tibetan","Yi-Southern-Muji.htm","Dr. Jamin Pelkey, La Trobe University, Australia /SIL International, 11 November 11, 2008.","decimal","","Southern Muji has a decimal system. Southern Muji is a language in the Southeastern Ngwi group. Note that the forms of compound numerals 13 to 19, 22 to 29, 30, 40, 50, 60, 70, 80, 90, 200 and 2000 need to be checked with new data.",""
"385","sout2723-1","Nesu Yi, China","sout2723","Southern Nisu","nsd","Eurasia",23.058,101.412,"Sino-Tibetan","Nesu-Yi.htm","Prof. Bai Bi Bo, Research Centre for Endangered Languages, Yuxi Normal University, Yuxi City, Yunnan, China, December 18, 2010.",NA,"","Nesu is a newly discovered Yi language.",""
