ID,Local_ID,Language_ID,Parameter_ID,Value,Form,Segments,Comment,Source,Cognacy,Loan,Problematic,Other_Form,Variant_ID
cacu1241-1-1-1,,cacu1241-1,1,bǐk,bǐk,[],''one'',['chan2019'],,False,False,,1
cacu1241-1-2-1,,cacu1241-1,2,tʃên,tʃên,[],''two'',['chan2019'],,False,False,,1
cacu1241-1-3-1,,cacu1241-1,3,bǐk-pejʔ-kan-ni,bǐk-pejʔ-kan-ni,[],''three'' (lit. one-be.friend/together-NEG-ADJVZ 'one with no company) pejʔ might be a grammaticalized form of peh-h?m 'be.friends/together-exist', as for now, it can only be translated as 'three', always a bound form.,['chan2019'],,False,False,,1
cacu1241-1-3-2,,cacu1241-1,3,together-exist',together-exist',[],,['chan2019'],,False,False,,1
cacu1241-1-4-1,,cacu1241-1,4,tʃên-na-mîk,tʃên-na-mîk,[],''four'' (two/partner-PL.inanimate-reciprocal 'each other have a partner'),['chan2019'],,False,False,,1
cacu1241-1-5-1,,cacu1241-1,5,bǐk-hĩʔ-bǔ tejʔja,bǐk-hĩʔ-bǔ tejʔja,[],''five'' (one-conmitative-LOC/EMPHZ hand 'with one hand'),['chan2019'],,False,False,,1
cacu1241-1-6-1,,cacu1241-1,6,bǐk-hĩʔ-bǔ tejʔja bǐk-têjʔ-tib-dubʔ ʔɨbʔ-ni,bǐk-hĩʔ-bǔ tejʔja bǐk-têjʔ-tib-dubʔ ʔɨbʔ-ni,[],''six'' (one-COMM-LOC/EMPHZ hand one-hand-finger-CL:pointed take.out-ADJVZ 'with one hand [and] take one finger out'),['chan2019'],,False,False,,1
cacu1241-1-7-1,,cacu1241-1,7,ǐk-hĩʔ-bǔ tejʔja tʃêne-têjʔ-tib-dubʔ ʔɨbʔ-ni,ǐk-hĩʔ-bǔ tejʔja tʃêne-têjʔ-tib-dubʔ ʔɨbʔ-ni,[],''seven'' (one-COMM-LOC/EMPHZ hand two/partner-hand-finger-CL:pointed take.out-ADJVZ 'with one hand [and]take two fingers out'),['chan2019'],,False,False,,1
cacu1241-1-8-1,,cacu1241-1,8,bǐk-hĩʔ-bǔ tejʔja bǐk-pêjʔ-kan-ni-têjʔ-tib-dubʔ ʔɨbʔ-ni,bǐk-hĩʔ-bǔ tejʔja bǐk-pêjʔ-kan-ni-têjʔ-tib-dubʔ ʔɨbʔ-ni,[],''eight'' (one-COMM-LOC/EMPHZ hand one-friend-NEG-ADJVZ-CL:pointed take.out-ADJVZ 'with one hand [and] take three out'),['chan2019'],,False,False,,1
cacu1241-1-9-1,,cacu1241-1,9,bǐk-hĩʔ-bǔ tejʔja tʃêne-na-mîk-têjʔ-tib-dubʔ ʔɨbʔ-ni,bǐk-hĩʔ-bǔ tejʔja tʃêne-na-mîk-têjʔ-tib-dubʔ ʔɨbʔ-ni,[],''nine'' (one-COMM-LOC/EMPHZ hand two/partner-PL.INAN-RECIPR-CL:pointed take.out-ADJVZ 'with one hand [and] take four fingers out'),['chan2019'],,False,False,,1
cacu1241-1-10-1,,cacu1241-1,10,tʃêne-wã paʔ-têiʔja,tʃêne-wã paʔ-têiʔja,[],''ten'' (two/partner-PL.anim like.this-hand 'two hands like this'),['chan2019'],,False,False,,1
cacu1241-1-11-1,,cacu1241-1,11,tʃên-wã paʔ-têiʔja-hĩʔ hit-tib-beʔ-dubʔ ʔɨbʔ-ni,tʃên-wã paʔ-têiʔja-hĩʔ hit-tib-beʔ-dubʔ ʔɨbʔ-ni,[],''eleven'' (two/partner-PL.anim like.this-hand-COMM foot-finger-AUG-CL:pointed take.out-ADJVZ 'with two hands like this [and] take one big foot finger out'),['chan2019'],,False,False,,1
cacu1241-1-12-1,,cacu1241-1,12,tʃêne-wã paʔ-têiʔja-hĩʔ tʃêne-hit-tib-na-beʔ-dubʔ ʔɨbʔ-ni,tʃêne-wã paʔ-têiʔja-hĩʔ tʃêne-hit-tib-na-beʔ-dubʔ ʔɨbʔ-ni,[],''twelve'',['chan2019'],,False,False,,1
cacu1241-1-13-1,,cacu1241-1,13,tʃêne-wã paʔ-têiʔja-hĩʔ bǐk-pêjʔ-kan-ni-hit-tib-na-beʔ-dubʔ ʔɨbʔ-ni,tʃêne-wã paʔ-têiʔja-hĩʔ bǐk-pêjʔ-kan-ni-hit-tib-na-beʔ-dubʔ ʔɨbʔ-ni,[],''thirteen'',['chan2019'],,False,False,,1
cacu1241-1-14-1,,cacu1241-1,14,tʃêne-wã paʔ-têiʔja-hĩʔ tʃêne-na-mîk-hit-tib-na-beʔ-duʔ ʔɨbʔ-ni,tʃêne-wã paʔ-têiʔja-hĩʔ tʃêne-na-mîk-hit-tib-na-beʔ-duʔ ʔɨbʔ-ni,[],''fourteen'',['chan2019'],,False,False,,1
cacu1241-1-15-1,,cacu1241-1,15,tʃêne-wã paʔ-têiʔja-hĩʔ bǐk-hitʃa ʔɨbʔ-ni,tʃêne-wã paʔ-têiʔja-hĩʔ bǐk-hitʃa ʔɨbʔ-ni,[],''fifteen'' (two/partner-PL.anim like.this-hand-comm one-foot take.out-ADJVZ 'with two hands like this [and] take one foot out"),['chan2019'],,False,False,,1
cacu1241-1-16-1,,cacu1241-1,16,tʃêne-wã paʔ-têiʔja-hĩʔ bǐk-hitʃa-hĩʔ hit-tib-beʔ-dubʔ ʔɨbʔ-ni,tʃêne-wã paʔ-têiʔja-hĩʔ bǐk-hitʃa-hĩʔ hit-tib-beʔ-dubʔ ʔɨbʔ-ni,[],''sixteen''(two/partner-PL.anim like.this-hand-comm one-foot-comm foot-finger-AUG-CL:pointed take.out-ADJVZ 'with two hands like this with one feet [and] take one finger foot out"),['chan2019'],,False,False,,1
cacu1241-1-17-1,,cacu1241-1,17,tʃêne-wã paʔ-têiʔja-hĩʔ bǐk-hitʃa-hĩʔ tʃêne-na-hit-tib-beʔ-dubʔ ʔɨbʔ-ni,tʃêne-wã paʔ-têiʔja-hĩʔ bǐk-hitʃa-hĩʔ tʃêne-na-hit-tib-beʔ-dubʔ ʔɨbʔ-ni,[],''seventeen'' (two/partner-PL.anim like.this-hand-comm one-foot-comm two/partner-PL-foot-finger-AUG-CL:pointed take.out-ADJVZ 'with two hands like this with one feet [and] take two finger foot out"),['chan2019'],,False,False,,1
cacu1241-1-18-1,,cacu1241-1,18,tʃêne-wã paʔ-têiʔja-hĩʔ bǐk-hitʃa-hĩʔ bǐk-pêjʔ-kan-nit-hit-tib-na-beʔ-dubʔ ʔɨbʔ-ni,tʃêne-wã paʔ-têiʔja-hĩʔ bǐk-hitʃa-hĩʔ bǐk-pêjʔ-kan-nit-hit-tib-na-beʔ-dubʔ ʔɨbʔ-ni,[],''eighteen'' (two/partner-PL.anim like.this-hand-comm one-foot-comm one-be.friend-NEG-PL-foot-finger-AUG-CL:pointed take.out-ADJVZ 'with two hands like this with one feet [and] take three finger foot out"),['chan2019'],,False,False,,1
cacu1241-1-19-1,,cacu1241-1,19,tʃêne-wã paʔ-têiʔja-hĩʔ bǐk-hitʃa-hĩʔ tʃêne-na-mîk-dubʔ-hit-tib-na-beʔ-dubʔ ʔɨbʔ-ni,tʃêne-wã paʔ-têiʔja-hĩʔ bǐk-hitʃa-hĩʔ tʃêne-na-mîk-dubʔ-hit-tib-na-beʔ-dubʔ ʔɨbʔ-ni,[],''nineteen'' (two/partner-PL.anim like.this-hand-comm one-foot-comm two/partner-PL-REC-foot-finger-AUG-CL:pointed take.out-ADJVZ 'with two hands like this with one feet [and] take four finger foot out",['chan2019'],,False,False,,1
cacu1241-1-20-1,,cacu1241-1,20,tʃêne-wã paʔ-têiʔja-hĩʔ  tʃêne-wã paʔ-hitʃa-bed-ni,tʃêne-wã paʔ-têiʔja-hĩʔ  tʃêne-wã paʔ-hitʃa-bed-ni,[],''twenty'' (two/partner-PL.anim like.this-hand-comm two-pl.anim like.this-foot-be.full-adjvz 'with two hands [and] two feet',['chan2019'],,False,False,,1
