ID,Local_ID,Language_ID,Parameter_ID,Value,Form,Segments,Comment,Source,Cognacy,Loan,SourceFile,Problematic,Other_Form,Variant_ID
cara1272-1-1,,cara1272,1,hĩkã-,hĩkã-,[],( j = h),[],,False,Carapana.htm,False,,1
cara1272-1-2,,cara1272,1,c = k,c = k,[],,[],,False,Carapana.htm,True,,1
cara1272-2-1,,cara1272,2,pʉ̃ɡa-,pʉ̃ɡa-,[],,[],,False,Carapana.htm,False,,1
cara1272-3-1,,cara1272,3,itia-,itia-,[],,[],,False,Carapana.htm,False,,1
cara1272-4-1,,cara1272,4,bapa-ri-kãnakã-,bapa-ri-kãnakã-,[],"( litː bapa = pair, kãnakã- = have ? or quantity ? )",[],,False,Carapana.htm,False,,1
cara1272-5-1,,cara1272,5,hĩkã-wãmo-kãrõ or hĩkã wãmo-kãnakã.,hĩkã-wãmo-kãrõ or hĩkã wãmo-kãnakã.,[],"(litː ''one hand, complete quantity'' )",[],,False,Carapana.htm,True,,1
cara1272-6-1,,cara1272,6,hĩkã wãmo-kãnakã ape wãmo hĩkã penirõ,hĩkã wãmo-kãnakã ape wãmo hĩkã penirõ,[],"(ape = other, penirõ  (cogiendo) = ? )",[],,False,Carapana.htm,False,,1
cara1272-7-1,,cara1272,7,hĩkã wãmo-kãnakã ape wãmo pʉ̃ɡa penirõ,hĩkã wãmo-kãnakã ape wãmo pʉ̃ɡa penirõ,[],,[],,False,Carapana.htm,False,,1
cara1272-8-1,,cara1272,8,hĩkã wãmo-kãnakã ape wãmo itia penirõ,hĩkã wãmo-kãnakã ape wãmo itia penirõ,[],,[],,False,Carapana.htm,False,,1
cara1272-9-1,,cara1272,9,hĩkã wãmo-kãnakã ape wãmo bapa-ri-kãnakã- penirõ,hĩkã wãmo-kãnakã ape wãmo bapa-ri-kãnakã- penirõ,[],,[],,False,Carapana.htm,False,,1
cara1272-10-1,,cara1272,10,pʉ̃ɡa-wãmo-kãrõ,pʉ̃ɡa-wãmo-kãrõ,[],"( litː ''two hands, complete quantity )",[],,False,Carapana.htm,False,,1
cara1272-11-1,,cara1272,11,pʉ̃ɡa-wãmo-kãnakã ape rupo-re hĩkã penirõ,pʉ̃ɡa-wãmo-kãnakã ape rupo-re hĩkã penirõ,[],( litː rupo = ''foot'' ),[],,False,Carapana.htm,False,,1
cara1272-12-1,,cara1272,12,pʉ̃ɡa-wãmo-kãnakã ape rupo-re pʉ̃ɡa penirõ,pʉ̃ɡa-wãmo-kãnakã ape rupo-re pʉ̃ɡa penirõ,[],,[],,False,Carapana.htm,False,,1
cara1272-13-1,,cara1272,13,pʉ̃ɡa-wãmo-kãnakã ape rupo-re itia penirõ,pʉ̃ɡa-wãmo-kãnakã ape rupo-re itia penirõ,[],,[],,False,Carapana.htm,False,,1
cara1272-14-1,,cara1272,14,pʉ̃ɡa-wãmo-kãnakã ape rupo-re bapa-ri-kãnakã penirõ,pʉ̃ɡa-wãmo-kãnakã ape rupo-re bapa-ri-kãnakã penirõ,[],,[],,False,Carapana.htm,False,,1
cara1272-15-1,,cara1272,15,pʉ̃ɡa-wãmo-kãnakã hĩkã rupo-re petirõ,pʉ̃ɡa-wãmo-kãnakã hĩkã rupo-re petirõ,[],( litː petirõ = todo = toe ?),[],,False,Carapana.htm,False,,1
cara1272-16-1,,cara1272,16,pʉ̃ɡa-wãmo-kãnakã hĩkã rupo peti rupo-re hĩkã petirõ,pʉ̃ɡa-wãmo-kãnakã hĩkã rupo peti rupo-re hĩkã petirõ,[],,[],,False,Carapana.htm,False,,1
cara1272-17-1,,cara1272,17,pʉ̃ɡa-wãmo-kãnakã hĩkã rupo peti rupo-re pʉ̃ɡa petirõ,pʉ̃ɡa-wãmo-kãnakã hĩkã rupo peti rupo-re pʉ̃ɡa petirõ,[],,[],,False,Carapana.htm,False,,1
cara1272-18-1,,cara1272,18,pʉ̃ɡa-wãmo-kãnakã hĩkã rupo peti rupo-re itia petirõ,pʉ̃ɡa-wãmo-kãnakã hĩkã rupo peti rupo-re itia petirõ,[],,[],,False,Carapana.htm,False,,1
cara1272-19-1,,cara1272,19,pʉ̃ɡa-wãmo-kãnakã hĩkã rupo peti rupo-re bapa-ri-kãnakã petirõ,pʉ̃ɡa-wãmo-kãnakã hĩkã rupo peti rupo-re bapa-ri-kãnakã petirõ,[],,[],,False,Carapana.htm,False,,1
cara1272-20-1,,cara1272,20,pʉ̃ɡa-wãmo-kãnakã pʉ̃ɡa-rupo petirõ,pʉ̃ɡa-wãmo-kãnakã pʉ̃ɡa-rupo petirõ,[],"(litː ''two hands, two feet finished'' )",[],,False,Carapana.htm,False,,1
